{
  "schema_version": "0.1",
  "template": "porsche_992_gt3",
  "meta": { "name": "Zone Demo", "author": "Jay", "description": "Exercises per-zone fills." },
  "palette": { "primary": "#e8e8e8", "dark": "#101010", "gold": "#c9a227", "red": "#b01020" },
  "base": { "fill": { "type": "solid", "color": "#e8e8e8" } },
  "zones": {
    "roof": { "fill": { "type": "solid", "color": "#101010" } },
    "hood": { "fill": { "type": "solid", "color": "#101010" } },
    "front_bumper": { "fill": { "type": "solid", "color": "#101010" } },
    "rear_wing": { "fill": { "type": "solid", "color": "#101010" } },
    "door_left": { "fill": { "type": "solid", "color": "#c9a227" } },
    "door_right": { "fill": { "type": "solid", "color": "#c9a227" } },
    "rear_quarter_left": { "fill": { "type": "solid", "color": "#b01020" } },
    "rear_quarter_right": { "fill": { "type": "solid", "color": "#b01020" } },
    "mirror_left": { "fill": { "type": "solid", "color": "#b01020" } },
    "mirror_right": { "fill": { "type": "solid", "color": "#b01020" } }
  },
  "materials": { "default": "gloss", "zones": { "roof": "matte" } }
}
